,teamNumber,nameFull,nameShort,city,stateProv,country,rookieYear,robotName,districtCode,schoolName,website,homeCMP
649,1868,NASA/NASA Ames Research Center/St. Jude Medical Foundation/Google/Nvidia/Brin Worcicki Foundation/Qualcomm/Intuitive Surgical/Motorola/World Metal Finishing/Applied Welding/Weiss Enterprises/Solidworks/Wildbit/Fiber Internet Center & Girl Scout Troop 62868,Space Cookies,Mountain View,California,USA,2006,,,Girl Scout Troop 62868,,CMPTX
650,1872,Colegio San Ignacio de Loyola,Steel Lions,San Juan,Puerto Rico,USA,2006,,,Colegio San Ignacio de Loyola,,CMPTX
651,1876,Baird Family/Beaufort County School District/Palmetto Electric Co-op/Hilton Head Concours de Elegance/Spartina 449/Sunset Rentals & Hilton Head Island High,Beachbotics,Hilton Head Island,South Carolina,USA,2006,,,Hilton Head Island High,,CMPTX
652,1880,NASA/Bloomberg & East Harlem Tutorial Program,Warriors of East Harlem,New York,New York,USA,2006,,,East Harlem Tutorial Program,,CMPMI
654,1885,US STEM Foundation/Lockheed Martin/Macedon Technologies/DataSync Technologies/ASCO/Prince William County Schools/A-1 Flood Tech & Battlefield High,ILITE Robotics,Haymarket,Virginia,USA,2006,,CHS,Battlefield High,,CMPMI
655,1891,Micron Technology/Plexus & Mountain View High School,Bullbots,Meridian,Idaho,USA,2006,,,Mountain View High School,,CMPTX
656,1895,"Manassas City Public Schools Education Foundation, INC/Lockheed Martin/Micron Technology, Inc./Leidos&Osbourn High",Lambda Corps,Manassas,Virginia,USA,2006,,CHS,Osbourn High,,CMPMI
657,1896,"General Motors/Grand Traverse Manufacturers' Golf Outing/Cone Drive Operations, Inc. & Home School",Concussive Engineers,Traverse City,Michigan,USA,2006,,FIM,Home School,,CMPMI
658,1899,Microsoft/OSPI/Bellevue Schools Foundation & Interlake Senior High School,Saints Robotics,Bellevue,Washington,USA,2006,,PNW,Interlake Senior High School,,CMPTX
659,1902,"Lockheed Martin/Magnus Hi-Tech/State of Florida/United Therapeutics/Comcast NBC Universal/BAE Systems/Disney VoluntEARS/Stage Equipment and Lighting/Cannon Law/Castle Ventures/Central Florida Chapter Fluid Power Society/Elise Cronin-Hurley Web & Graphic Design&Orange County 4-H, Florida",Exploding Bacon,Orlando,Florida,USA,2006,,,"Orange County 4-H, Florida",,CMPTX
660,1908,NASA/BAE Systems -Norfolk Ship Repair/Rommel's ACE Hardware/Northampton County Education Foundation/Northampton County High School Alumni/Northampton County Public Schools/Exmore Rotary Club/Cape Charles Rotary/Onancock Rotary Club & Northampton High,ShoreBots,Eastville,Virginia,USA,2006,,CHS,Northampton High,,CMPMI
661,1912,NASA/DoDSTEM/Aerojet Rocketdyne/Textron Marine & Land/U.S. Naval Research Laboratory/Alliance Laser/St. Tammany Parish School Board&Salmen High School&Northshore High School,Team Combustion,Slidell,Louisiana,USA,2006,,,Northshore High School & Salmen High School,,CMPTX
662,1915,NASA Headquarters/Bechtel/Dept. of Defense STEM/DC Public Schools/Google/Hilton&Mckinley Technology Hs,MTHS Firebird Robotics,Washington,District of Columbia,USA,2006,,CHS,Mckinley Technology Hs,,CMPMI
663,1918,Newaygo County Regional Educational Service Agency/The Fremont Area Community Foundation/The Gerber Foundation/Kaydon Bearings/The people of Newaygo County&Family/Community,NC GEARS,Fremont,Michigan,USA,2006,,FIM,Family/Community,,CMPMI
664,1922,MicroDaq.com Ltd&Hopkinton High School&John Stark Regional High School&Hopkinton Middle School,Oz-Ram,Contoocook,New Hampshire,USA,2006,,NE,Hopkinton High School & John Stark Regional High School & Hopkinton Middle School,,CMPMI
665,1923,"NRG/Bristol Myers Squibb/BrecoFlex Co., LLC/SolidWorks/Sensor Networks Inc/Friends & Families of 1923/RoBART Inc.&Wwindsor  Plainsboro North&Wwindsor  Plainsboro South",The MidKnight Inventors,Plainsboro,New Jersey,USA,2006,,MAR,Wwindsor  Plainsboro North & Wwindsor  Plainsboro South,,CMPMI
666,1927,NASA/Stennis Space Center/Huntington Ingalls Industries/Mississippi Power Company/BAE Systems&St Patrick Catholic High School,Tempest,Biloxi,Mississippi,USA,2006,,,St Patrick Catholic High School,,CMPTX
668,1939,The Barstow School&THE BARSTOW SCHOOL,THE KUHNIGITS,Kansas City,Missouri,USA,2006,,,THE BARSTOW SCHOOL,,CMPTX
669,1940,Whirlpool Corporation / Benton Harbor Area Schools & Benton Harbor High School,The Tech Tigers,Benton Harbor,Michigan,USA,2006,,FIM,Benton Harbor High School,,CMPMI
674,1965,Analog Devices Inc/Raytheon&Saint Joseph Preparatory High School,Firebirds,Allston,Massachusetts,USA,2006,,NE,Saint Joseph Preparatory High School,,CMPMI
675,1967,"Apple/Barrese Family/Qualcomm/BAE Systems/Brin Wojcicki Foundation/Studio Current/Intuitive Surgical/NVIDIA/Kirkland Family/SJ Leadership Coach, LLC/Labonville Family/Wireless Communications Alliance/MDR Precision/SolidWorks&Notre Dame High School",The Janksters,San Jose,California,USA,2006,,,Notre Dame High School,,CMPTX
676,1972,Lowe's/Imperial Valley MESA & Central Union High,Searing Engineering,El Centro,California,USA,2006,,,Central Union High,,CMPTX
677,1973,Boston Scientific/Gentle Giants Moving Company/The Makery @ Coolidge Corner/Gelfand Family Foundation/Textron Corporation/Harvard Business School/Irene Chan/MIT/Boston University College of Engineering/Joan K Sexton Foundation/Search Results The Hamilton Company/Tufts University&Brighton High&Family/Community&Family/Community,Burning Tiger   #1973,"Brighton, Brookline",Massachusetts,USA,2006,,NE,Family/Community & Family/Community & Brighton High,,CMPMI
678,1977,Northrop Grumman&Loveland High School,The PowerSquids ,Loveland,Colorado,USA,2006,,,Loveland High School,,CMPTX
679,1982,Cruise/Shawnee Mission School District/Shawnee Mission Education Foundation/Garmin/Shawnee Mission Public Schools/BKeeney Software/BlueScope Construction &Shawnee Mission Northwest High,Cougar Robotics,Shawnee,Kansas,USA,2007,,,Shawnee Mission Northwest High,,CMPTX
680,1983,The Boeing Company/Lockheed Martin/OmanTek/OMAX&4-H&Aviation High School,Skunk Works Robotics,Seattle,Washington,USA,2007,,PNW,Aviation High School & 4-H,,CMPTX
681,1984,Garmin/KC STEM/Shawnee Mission Education Foundation/Price Chopper/Home Depot/Papa John's/Art Wells/View Sign and Light&Shawnee Mission South High,Jawas,Overland Park,Kansas,USA,2007,,,Shawnee Mission South High,,CMPTX
682,1985,Monsanto Fund/The Boeing Company/Hazelwood School District/Navy&Hazelwood Central High,Robohawks,Florissant,Missouri,USA,2007,,,Hazelwood Central High,,CMPTX
683,1986,"Venture Industrial Products/National Instruments/TradeBot/Intuitive Surgical, Inc/Billy Goat Industries/IBM/Paradise Park/Kastle Grinding/KC STEM Alliance/Michael & Jayne Hartwig/Tom Cates/Shawn & Kristen Roy/American Century Investments/The Prevost Family Foundation/Dairy Queen/SPX Cooling Technologies/The Brenneke Family/Chris Hope/Harlan Spatz/Delmer & Ruth Harris&Lee's Summit West High",Team Titanium,Lees Summit,Missouri,USA,2007,,,Lee's Summit West High,,CMPTX
684,1987,"Staples Foundation/Brunson Instruments/Green Law Firm/KC Stem Alliance/Matt & Beth Settle/Jonathan Smith/Paradise Park/Chuck Stephenson/Sean & Michelle Ahern/Lee's Summit Tribune/Grider Orthodontics/Kent Werremeyer/Show Me Controls/Fastenal/Stonehaus Winery/Jon Plaas in memory of Adam Stevens/Lee & Rachel Stevens/Talley Family/R&D Leverage/Cox Air Systems, Inc./Paul Sites/Painted with Powder/Wentworth Technology Solutions, LLC/Allied Plastics/Laird Plastics/Westlake Ace Hardware/Git Hub/Haimer/Industrial Machine and Gear/Maruka/New Mill Capital/Royal Products/Summit Tech Academy/WM. F. Hurst/Dautenhahn Family/Ben Glodowski/FRC Team 1987 Coaches & Mentors/Bledsoe Rentals/Chris Hope/Etter Family/Little Family&Lee'S Summit North High",Broncobots,Lees Summit,Missouri,USA,2007,,,Lee'S Summit North High,,CMPTX
685,1989,NDEP/Thor Labs/Picatinny Arsenel&Vernon Twp High,Viking Robotics,Vernon,New Jersey,USA,2007,,MAR,Vernon Twp High,,CMPMI
686,1991,UTC/Pratt & Whitney/University of Hartford/Hartford Public Schools/Law Offices of Joseph Prokop/Tsunami Tsolutions/Saybrook Hardware/Aetna/Nutmeg State Federal Credit Union/Lagana Florist/Schaller Acura & 4-H & University High School,Dragons,Hartford,Connecticut,USA,2007,,NE,4-H & University High School,,CMPMI
687,1994,Kansas City Kansas Public Schools/KC Stem Alliance & F L Schlagle High,Quixote,Kansas City,Kansas,USA,2007,,,F L Schlagle High,,CMPTX
688,1997,Bishop Miege High School/Friends of STAGrobotics/Garmin Industries&Bishop Miege High School,Stag Robotics,Roeland Park,Kansas,USA,2007,,,Bishop Miege High School,,CMPTX
689,2001,Hickman Mills School District / Best Buy / KC STEM Alliance & Ruskin High School,HERMES,Kansas City,Missouri,USA,2007,,,Ruskin High School,,CMPTX
690,2010,Delphi Corporation/Cleveland Communications/Vallourec&Champion High School,The Lightning Bots,Warren,Ohio,USA,2007,,,Champion High School,,CMPMI
692,2016,Johnson & Johnson Consumer and Personal Products Worldwide/nrg/DOTC STEM Picatinny/National Defense Education Program/Ewing Township Education Association/Morris Millwork/RJD Machining Products Inc.&Ewing High&New Jersey School for the Deaf,Mighty Monkey Wrenches,Ewing,New Jersey,USA,2007,,MAR,New Jersey School for the Deaf & Ewing High,,CMPMI
693,2022,Caterpillar Inc/Mad Lab Industries & Il Mathematics & Science Academy,Titan Robotics,Aurora,Illinois,USA,2007,,,Il Mathematics & Science Academy,,CMPMI
694,2027,Westbury High School & Westbury High School,Robotic Dragons,Old Westbury,New York,USA,2007,,,Westbury High School & Westbury High School,,CMPMI
695,2028,Community Knights/TE Connectivity/Lockheed Martin/National Defense Education Program/SPAWAR Systems Center Atlantic/Booz Allen Hamilton/Huntington Ingalls Industries/Newport News Shipbuilding Apprentice School/Canon Virginia/Rex Companies/Hampton City Schools&Phoebus High,Phantom Mentalist,Hampton,Virginia,USA,2007,,CHS,Phoebus High,,CMPMI
696,2035,Carmel Unified School District/Naval Post Graduate School/National Defense Education Program/Monterey Bay Aquarium Research Institute/Brin Wojciciki Foundation/Padre Parents/El Camino Machine and Welding/Apple/Taylor Farms/Solidworks&Carmel High,Robo Rockin' Bots,Carmel,California,USA,2007,,,Carmel High,,CMPTX
697,2036,Medtronic/Ball Aerospace & Technologies Corp/Neya/Spire/The Tholakapalli Family/Beau Jo's Pizza&Fairview High School,The Black Knights,Boulder,Colorado,USA,2007,,,Fairview High School,,CMPTX
698,2039,"Superior Joining Technologies, Inc/UTC AEROSPACE SYSTEMS/WOODWARD, INC./Rockford Robotics Inc & Neighborhood Group",Rockford Robotics,Machesney Park,Illinois,USA,2007,,,Neighborhood Group,,CMPMI
699,2040,Caterpillar/TE Connectivity/ABB/Stellar Systems/Cope Plastic/Ameren/HOI vending /Oerlein School of Cosmetology /Dunlap School District&Dunlap High School,DERT - Dunlap Eagles Robotics Team,Dunlap,Illinois,USA,2007,,,Dunlap High School,,CMPMI
700,2046,The Boeing Company/Washington State OSPI/Flow International Corporation/Pinnacle Medical Wellness/Alaska Airlines&Tahoma Senior High School,Bear Metal,Maple Valley,Washington,USA,2007,,PNW,Tahoma Senior High School,,CMPTX
701,2048,"Detroit Public Schools/Comcast/DADARA/Gentherm/DTE Energy/2014 FRC Hardship Grant, MEZ/FORD/VDV Concessions,LLC/MEZ&Detroit International Academy for Young Women",The Pink Panthers,Detroit,Michigan,USA,2007,,FIM,Detroit International Academy for Young Women,,CMPMI
702,2051,Caterpillar Inc./HuMoTech/Neff Automation/Greater Pittsburgh Specialty Advertising Inc/Pasquale's Pizzeria & a W Beattie Career Center,The Beattie Bulldogs,Allison Park,Pennsylvania,USA,2007,,,a W Beattie Career Center,,CMPMI
703,2052,Groves Foundation/Medtronic/3M/SDS&Irondale Senior High,KnightKrawler,New Brighton,Minnesota,USA,2007,,,Irondale Senior High,,CMPMI
704,2053,BAE Systems/Lockheed Martin/Empire Plastics/Klein Steel&Union Endicott High School&Vestal Senior High School,TigerTronics,Endicott,New York,USA,2007,,,Union Endicott High School & Vestal Senior High School,,CMPMI
705,2054,General Motors Grand Rapids/Sebright Products/Midway Chevrolet of Plainwell/Hopkins Propane/Weick Brothers INC.&Hopkins High School,Tech Vikes,Hopkins,Michigan,USA,2007,,FIM,Hopkins High School,,CMPMI
707,2059,Optimist International/IBM/Duke Energy/NASA/Nutanix/Terracon/Sellware&Athens Drive High,The Hitchhikers,Apex,North Carolina,USA,2007,,NC,Athens Drive High,,CMPTX
708,2062,Rockwell Automation/PowerMation/GE Volunteers/Toshiba/Fastenal/School District of Waukesha/SCORE&Waukesha Engineering Preparatory Academy&West High&South High&North High&Waukesha Academy of Health Professions,C.O.R.E  2062,Waukesha,Wisconsin,USA,2007,,,Waukesha Academy of Health Professions & Waukesha Engineering Preparatory Academy & West High & South High & North High,,CMPMI
709,2064,United Rentals/Google/United Technologies/Sikorsky of Lockheed Martin/Nexus Design/Ace Hardware of Woodbury&Pomperaug Regional High School,The Panther Project,Southbury / Middlebury,Connecticut,USA,2007,,NE,Pomperaug Regional High School,,CMPMI
710,2067,Bishop's Orchards/United Technologies/Rockwell Automation/Moroso Performance Products/Lockheed/Butterfly Network/Intuitive Surgical/Medtronic&4H,Apple Pi,Guilford,Connecticut,USA,2007,,NE,4H,,CMPMI
711,2068,"Lockheed Martin/SPARK - Prince William County Public School's Education Foundation/Prince William County Public Schools/QMT Windchimes/Overlook Systems Technologies, Inc./FIRST Robotics/BAE Systems/Progeny Systems Corporation/Micron Technology/Osbourn Park High School/Stellar Solutions Foundation/Marine Corps Systems Command&Osbourn Park High",Metal Jackets,Manassas,Virginia,USA,2007,,CHS,Osbourn Park High,,CMPMI
712,2070,Ridgefield Board of Education/Ridgefield PTA/Picatinny STEM/General Devices/DoDSTEM & Ridgefield Memorial High,Royals,Ridgefield,New Jersey,USA,2007,,MAR,Ridgefield Memorial High,,CMPMI
713,2073,Siemens Mobility/ECMC Foundation/Sutter Home Winery&Pleasant Grove High,EagleForce,Elk Grove,California,USA,2007,,,Pleasant Grove High,,CMPTX
714,2075,Bulb Digital /Herman Miller/Challenge Manufacturing/Dick & Betsy DeVos Foundation/Rescom Electric Inc/W Soule/Repair Technologies LLC/Lakelind Electric&West Catholic High School,Enigma Robotics,Grand Rapids,Michigan,USA,2007,,FIM,West Catholic High School,,CMPMI
715,2077,"Rockwell Automation/Johnson Control /GE Volunteers of GE Healthcare/Department of Instruction, Wisconsin/Sharp Packaging Systems by Pregis/Kettle Moraine Education Foundation/Lockheed Martin/Farris Automated Systems/CBRE-Environmental Systems Inc./PPG/Polodna Family/Buchanan Family/Knaak Family/MSOE/Meyers Electric&Kettle Moraine High",Laser Robotics,Wales,Wisconsin,USA,2007,,,Kettle Moraine High,,CMPMI
716,2078,&St Pauls School,Robotic Wolves,Covington,Louisiana,USA,2007,,,St Pauls School,,CMPTX
717,2079,"United Technologies, Pratt & Whitney/Acorn Animal Hospital/Electric Time/4-H of Massachusetts &4-H ALARM Robotics 2079",4H ALARM Robotics,Bellingham,Massachusetts,USA,2007,,NE,4-H ALARM Robotics 2079,,CMPMI
718,2080,Intralox/Lockheed Martin/SPAWAR/Laurie Guidroz/Dan Wrinkles Plumbing/First Guaranty Bank/Intuitive Surgical Inc./Raising Cane's&Hammond High School,Torbotics,Hammond,Louisiana,USA,2007,,,Hammond High School,,CMPTX
719,2081,Advanced Technology Services/Caterpillar Inc/Martin Engineering/Global Heat Transfer&Peoria Notre Dame High School&Princeville High School&Metamora High School,Icarus,Peoria,Illinois,USA,2007,,,Metamora High School & Princeville High School & Peoria Notre Dame High School,,CMPMI
720,2083,Lockheed Martin/Adobe Systems & Conifer Senior High School,Team BLITZ,Conifer,Colorado,USA,2007,,,Conifer Senior High School,,CMPTX
721,2084,Spaulding Education Fund/The Hooper Fund/Manchester Masons/MIT Lincoln Lab/Pinpoint Laser Systems/Cape Ann Savings Bank/Lee Spence/Polaris&Manchester Essex Regional High School,Robots by the C,Manchester,Massachusetts,USA,2007,,NE,Manchester Essex Regional High School,,CMPMI
722,2085,"Genentech in cooperation with VPEF/Haddox Consulting Engineers/MedTech Water Systems/Freedlun Hydroseeding, Inc./Team Alumni Anthony Anuzzi, Colton Barty and Warren Whitman/Whit Whitman&Vacaville High",RoboDogs,Vacaville,California,USA,2007,,,Vacaville High,,CMPTX
723,2090,Sam O. Hirota Engineering/Leidos/SAIC/McDonalds of Hawaii/Universal Manufacturers Hawaii/Min Plastics/Friends of Hawaii Robotics & Punahou School,Buff 'n Blue,Honolulu,Hawaii,USA,2007,,,Punahou School,,CMPTX
724,2095,the Episcopal Academy,Direct Current,Newtown Square,Pennsylvania,USA,2007,,MAR,the Episcopal Academy,,CMPMI
726,2102,McCarthy Family Foundation/ViaSat/Nordson/Chief Digial Advisors/Qualcomm/Zodiac Pool Systems/Solar Turbines/Booz Allen Hamilton/NML/Families of Team 2102/San Dieguito Unified School District/SDA Associated Student Body/SAIC/Premier Stainless&San Dieguito High Academy,Team Paradox,Encinitas,California,USA,2007,,,San Dieguito High Academy,,CMPTX
727,2106,Luck Stone Corporation/Rockwell Automation&Goochland High&Goochland Middle,The Junkyard Dogs,Goochland,Virginia,USA,2007,,CHS,Goochland High & Goochland Middle,,CMPMI
728,2122,"Micron Technology, Inc./Hewlett Packard/J.C. Jeker Foundation/Monsanto Fund/Landmark Industrial/Laura Moore Cunningham Foundation/Trinity Trailers/Boise Schools Educational Foundation/Pacific Steel/Pedersen & Company PLLC/Idaho Stem Action Committee/Solidworks/Custom Fluid Power&Treasure Valley Math/Science",Team Tators,Boise,Idaho,USA,2007,,,Treasure Valley Math/Science,,CMPTX
729,2129,United Health/Seagate/Donaldson Foundation/Boston Scientific/Barr Engineering/3M Company/Thiele Technologies/Stratasys/TruNorth Solar/Williams Uptown/LHB Corporation&Southwest Senior High,Ultraviolet,Minneapolis,Minnesota,USA,2007,,,Southwest Senior High,,CMPMI
730,2130,Autodesk/Ripley Comegys Foundation/Idaho STEM Action Center/BNSF Railway Foundation/Frontier Communications/Mountain Ledgers/Maxfield Family Fund/Badger Boosters/Friends and Families of Alpha+/Boundary County School District 101&Bonners Ferry High School,Alpha+,Bonners Ferry,Idaho,USA,2007,,,Bonners Ferry High School,,CMPTX
731,2135,"Apple/KLA Tencor Corporation/Enseo, Inc./Qualcomm/ANSYS Inc/Brin Wojcicki Foundation/Intuitive Surgical, Inc/Spray Technology/Xilinx, Inc/Dassault  Systemes/Exatron/Barker Family/Bruno Family/Rachapudi Family/Tran Family&Presentation High School",Presentation Invasion,San Jose,California,USA,2007,,,Presentation High School,,CMPTX
732,2136,Neighborhood Group/Illinois Manufacturing Foundation & Farragut Career Academy Hs,Impossible Mission Force,Chicago,Illinois,USA,2007,,,Farragut Career Academy Hs & Neighborhood Group,,CMPMI
733,2137,FCA Foundation/ARC Investment of Auburn Hills/Oxford High School Career Technical Education/CEC Controls Company/Oakland University - School of Engineering and Computer Science/SMC Corporation/Kettering University/Oakland Orthropaedic Surgeons/Casemer Tool/CAMS CNC Software/Dessault Systems (Solidworks)/Village Tees/Michigan Department of Education/Stage 3 Productions/Quality Fastener and Supply/Pillar Design&Oxford High School,TORC,Oxford,Michigan,USA,2007,,FIM,Oxford High School,,CMPMI
734,2141,Nvidia & De La Salle High School,Spartonics,Concord,California,USA,2007,,,De La Salle High School,,CMPTX
735,2143,Core Vision Technology/ILC Alumni Association&Immanuel Lutheran High School,Team Tobor,Eau Claire,Wisconsin,USA,2007,,,Immanuel Lutheran High School,,CMPMI
736,2144,SHS/Google/Apple/Abbott Medical/WeDriveU/Dylan Hruska/SolidWorks&Sacred Heart Preparatory,Gators,Atherton,California,USA,2007,,,Sacred Heart Preparatory,,CMPTX
737,2145,GM Foundation/Valeo/TIDI/High Octane Printing/Vic Canever Chevrolet/Lake Fenton Community Schools/State of Michigan&Lake Fenton High School,HAZMATs,Linden,Michigan,USA,2007,,FIM,Lake Fenton High School,,CMPMI
738,2147,Elcon Construction/Bill Meyer/Wagstaff/F5/Greater Spokane Incorporated/Boeing/Mackay Manufacturing&West Valley High School,CHUCK,Spokane,Washington,USA,2007,,PNW,West Valley High School,,CMPTX
739,2148,Altek/Wagstaff  Inc./f5 Corporation & East Valley High School&Extension & East Valley High School&Extension,Mechaknights,Spokane,Washington,USA,2007,,PNW,East Valley High School&Extension & East Valley High School&Extension,,CMPTX
740,2151,Triton College & Proviso Math and Science Academy,Monty Pythons,Forest Park,Illinois,USA,2007,,,Proviso Math and Science Academy,,CMPMI
741,2152,Rotomation/VMA/Lockheed Martin/Ford Motor Co./State of Florida/FPL/Embry-Riddle Aeronautical University&Spruce Creek High School&University High School,S*M*A*S*H,Volusia County,Florida,USA,2007,,,Spruce Creek High School & University High School,,CMPTX
742,2158,National Instruments/Texas Workforce Commission/Apple/FIRST in Texas/REV Robotics/University of Texas at Austin/ausTIN CANs Supporters Group&Anderson H S,ausTIN CANs,Austin,Texas,USA,2007,,,Anderson H S,,CMPTX
743,2161,Underwriter's Laboratories/County Line Hardware/Sign A Rama/BERKSHIRE HATHAWAY & Walt Whitman High School,Robocats,Huntington Station,New York,USA,2007,,,Walt Whitman High School,,CMPMI
744,2164,Lee and Company LLC/Obermiller Construction/Families of Team 2164/Dains Custom Athletic Lockers/Baptist Missionary Transportation Ministry/Vance Brothers/Eerle M. Jorgensen Company/Kurzweils Country Meats/Anderson Engineering/Alpha Omega Industries/Elks Lodge #2791/Innovative Filtration/Sutherlands/Daylight Donuts/Family Center Farm & Home&Harrisonville High,The Core,Harrisonville,Missouri,USA,2007,,,Harrisonville High,,CMPTX
745,2165,Phillips 66 / Conoco Phillips / AEP / Bartlesville Rotary Club / Department of Defense STEM & Tri County Technology Center,Trailblazers,Bartlesville,Oklahoma,USA,2007,,,Tri County Technology Center,,CMPTX
746,2167,Northwest Missouri State University - Missouri Academy,Radical Tech,Maryville,Missouri,USA,2007,,,Northwest Missouri State University - Missouri Academy,,CMPTX
747,2168,Pfizer/ Groton Utilities/ DoDSTEM/ Google/ Hubble Incorporated/ The Hillery Company/R-D Manufacturing/J Steele Services/Charter Oak Credit Union/ PCC Structural/Mystic Women's Club&Robert E Fitch High School,Aluminum Falcons,Groton,Connecticut,USA,2007,,NE,Robert E Fitch High School,,CMPMI
748,2169,Boston Scientific Corp/UTC - United Technologies/UTC/Rotary Club of Prior Lake/Lunds & Byerlys Grocery/Engineering Partners/VTI security/Prior Lake-Savage Area Schools/Mankato State University (MSU)&Prior Lake High School,KING TeC,Savage,Minnesota,USA,2007,,,Prior Lake High School,,CMPMI
749,2170,UTC&Glastonbury High School,Titanium Tomahawks,Glastonbury,Connecticut,USA,2007,,NE,Glastonbury High School,,CMPMI
750,2171,Crown Point Community Foundation/Burrell Family Foundation/REMAX Pace Realty&Crown Point High School&Crown Point High School,RoboDogs,Crown Point,Indiana,USA,2007,,IN,Crown Point High School & Crown Point High School,,CMPMI
751,2172,Matrix Pointe Software/American Tank and Fabricating/Rockwell Automation&St Edward High School,Street Legal,Lakewood,Ohio,USA,2007,,,St Edward High School,,CMPMI
752,2175,Andeavor/Phillips Medisize/3M/Hubbard Broadcasting/Boston Scientific/Intertech&Math & Science Academy,The Fighting Calculators,Saint Paul,Minnesota,USA,2007,,,Math & Science Academy,,CMPMI
753,2177,Boston Scientific/PTC/Palmer Family&Convent of the Visitation School,The Robettes,Mendota Heights,Minnesota,USA,2007,,,Convent of the Visitation School,,CMPMI
754,2180,"NDEP/Sun Chemical Corporation/Valspar/Lockheed Martin/Mercer County Improvement Authority/FMC Technologies/HTEA and NJEA/Bristol-Myers Squibb/Princeton Partners, Inc/Nav-Air & Hamilton East  Steinert",Zero Gravity,Hamilton,New Jersey,USA,2007,,MAR,Hamilton East  Steinert,,CMPMI
755,2181,Medtronic/Altron/Dayton Rogers/NEMI/Park Precision/MBA Engineering/Steinwall Inc/Tri-State Truck Wash Of Worthington/Minneapolis Oxygen Company&Blaine Senior High,G.E.A.R.s (Great Engineers Awesome Robots),Blaine,Minnesota,USA,2007,,,Blaine Senior High,,CMPMI
756,2183,Entergy/DOW/Monsanto/Royal Productions/Laitram Corp/Intralox/Distefano Plumbing/Barnes and Noble/Ameriprise Financial/Cemball Industries/FLUOR Federal Petroleum Operations/beAed/St. Charles Parish Public Schools&Hahnville High School,Tigerbots,Boutte,Louisiana,USA,2007,,,Hahnville High School,,CMPTX
757,2186,BAE Systems&Westfield High,Dogs of Steel,Chantilly,Virginia,USA,2007,,CHS,Westfield High,,CMPMI
758,2187,Santee Cooper/Horry County School District & Academy for Technology and Academics,Team Volt,Conway,South Carolina,USA,2007,,,Academy for Technology and Academics,,CMPTX
759,2190,Petal School District/#FlyHighOmar/Kohler Engines/Mississippi Power&Petal High School,Team Hero,Petal,Mississippi,USA,2007,,,Petal High School,,CMPTX
760,2191,Bristol-Myers Squibb/Nordson Corp./Hamilton Township Education Assoc. HTEA/United States Army&Hamilton North  Nottingham,Flux Core,Hamilton,New Jersey,USA,2007,,MAR,Hamilton North  Nottingham,,CMPMI
761,2194,John Deere Horicon Works/PTC/Industrial Controls Engineering/Belke Financial Group/BCI Burke/Moraine Park Technical College/Milwaukee School of Engineering/Stone Foundation/Beine Milk Transport/HUI/Mid-States Aluminum/Bergstrom Automotive/Spiros Industries/JF Ahern/Holiday Automotive Group/MEC/Basic American Medical Products/Saputo Cheese/Hanson Refrigeration&Neighborhood Group&Fond Du Lac High School,Fondy Fire,Fond du Lac,Wisconsin,USA,2007,,,Neighborhood Group & Fond Du Lac High School,,CMPMI
762,2197,IN-Tek IN-Kote/AEP/Qubit Networks&New Prairie High School,Las Pumas,New Carlisle,Indiana,USA,2007,,IN,New Prairie High School,,CMPMI
763,2199,"The Kahlert Foundation/Booz Allen Hamilton/Leidos/Freedom Area Recreation Council/Carroll Technology Council/Foxhole Technology, Inc./Carroll County Public Library/Constellation Energy/Alliance Engineering&PIE3&Sykesville Middle&Liberty High&Century High",Robo-Lions,Finksburg,Maryland,USA,2007,,CHS,Century High & PIE3 & Liberty High & Sykesville Middle,,CMPMI
