,teamNumber,nameFull,nameShort,city,stateProv,country,rookieYear,robotName,districtCode,schoolName,website,homeCMP
1364,3618,"DTE Foundation/Public Schools of Petoskey/Rotary Club of Petoskey/Hestia Women's Giving Circle/Bear River Electric/Great Lakes Oral and Maxillofacial Surgery, P.C./DCL/Petoskey Plastics/Northwest Hydraulics & Engineering/Kilwins/Bill's Standard Auto Repair/Circuit Controls Corporation/Grannis Farley of Raymond James/Daifuku/4Front Credit Union/Redi-Rock/Demmer Corporation/Wendy's &Petoskey High School",Petoskey Paladins,Petoskey,Michigan,USA,2011,,FIM,Petoskey High School,,CMPMI
1365,3619,Birmingham Rotary Club/DEPSA ECE/Michigan Engineering Zone/Google/Ford Motor Company/Toyota/McNaughton-McKay Electric Company/The Berg Family/DADARA & Edison Public School Academy,Blackhawks,Detroit,Michigan,USA,2011,,FIM,Edison Public School Academy,,CMPMI
1366,3620,"Bosch/Whirlpool Corporation/St. Joseph Public Schools Foundation/Kay Manufacturing Co./Art & Image/Eagle Technologies Group/Liberty Steel/JR Automation Technologies/Lions Club of St. Joseph/Phyco Tech, Inc./Hanson Mold/Midwest Glass and Mirror/TPC Technologies/Gaishin Manufacturing/Beaudoin Electric/Vail Rubber&St. Joseph High School",Average Joes,Saint Joseph,Michigan,USA,2011,,FIM,St. Joseph High School,,CMPMI
1367,3623,Boys & Girls Club of Fitchburg and Leominster/Boston Scientific/COMCAST/DCU/TPE Solutions/TurboCare/Unitil/BIO-Techne/Department of Defense&Fitchburg and Leominster,Terror Bots,Leominster,Massachusetts,USA,2011,,NE,Fitchburg and Leominster,,CMPMI
1368,3624,"Half Hollow Hills Central School District/HHH Robotics, Inc./Underwriter Laboratories&Half Hollow Hills High School East&Half Hollow Hills High School West",ThunderColts,Huntington Station,New York,USA,2011,,,Half Hollow Hills High School West & Half Hollow Hills High School East,,CMPMI
1369,3627,State of Florida /Suncoast Technical College/DART Foundation&Pine View School&Suncoast Polytechnical High School&Riverview High School,The Jungle Robotics,Sarasota,Florida,USA,2011,,,Riverview High School & Pine View School,,CMPTX
1370,3630,"Oesterle Family/Breck School/Precision Associates, Inc./V-Belt Guys&Breck School&Breck School",The Stampede,Minneapolis,Minnesota,USA,2011,,,Breck School & Breck School,,CMPMI
1371,3632,Detroit Public Schools/State of Michigan/Ford Motor Company/SRT/University of Michigan/Google/Toyota/Mcnaughton-McKay Electric Company/The Berg Family/DADARA&Detroit School of Arts&Beyond The Corner,D-Techs,Detroit,Michigan,USA,2011,,FIM,Beyond The Corner & Detroit School of Arts,,CMPMI
1372,3633,Medtronics/Albert Lea High School/Cargill/Jenson Autobody/ITC&Albert Lea Senior High,Catalyst 3633,Albert Lea,Minnesota,USA,2011,,,Albert Lea Senior High,,CMPMI
1373,3634,Fairfield University/Lockheed Martin Company/NASA CT Space Grant/NEATEC/Stanley Black and Decker/Bridgeport Public Schools/Bridgeport Fittings/Connecticut Innovations/Bigelow Tea&Harding High School&Family/Community,Spark City,Bridgeport,Connecticut,USA,2011,,NE,Family/Community & Harding High School,,CMPMI
1374,3635,Boeing/Honeywell/Dixie Crows & Houston County Career Academy & Warner Robins High School & Northside High School & Houston County High School & Perry High School & Houston County Career Academy, Flying Legion ,Warner Robins,Georgia,USA,2011,,PCH,Houston County Career Academy & Warner Robins High School & Northside High School & Houston County High School & Perry High School & Houston County Career Academy,,CMPTX
1375,3636,The Boeing Company/SPEEA/Intel/Cascade Microtech/Mentor Graphics&Grant High School,Generals,Portland,Oregon,USA,2011,,PNW,Grant High School,,CMPTX
1376,3637,Nokia Bell Labs/Underwriters Laboratories/Raritan Valley Community College/NASA/Ethicon&Hunterdon Central High,The Daleks,Flemington,New Jersey,USA,2011,,MAR,Hunterdon Central High,,CMPMI
1377,3641,Pratt Miller/Magna/NISSAN/FCA Foundation/FORD/Cybernet Systems Corp./South Lyon Community Schools/State of Michigan/Spectrum Automation/Extreme Machine & South Lyon East High School & South Lyon High School,The Flying Toasters,South Lyon,Michigan,USA,2011,,FIM,South Lyon East High School & South Lyon High School,,CMPMI
1379,3647,Torrey Pines High School Foundation/Nordson/Qualcom/Rotary Club of Del Mar/Anocote Powder/MakerPlace/SolidWorks/JMI Realty&Torrey Pines High,Millennium Falcons,San Diego,California,USA,2011,,,Torrey Pines High,,CMPTX
1380,3648,Comcast & Thomas Jefferson High School,Sparta Robotica,Denver,Colorado,USA,2011,,,Thomas Jefferson High School,,CMPTX
1381,3650,"Department of Defense, STEM/FIRST Hardship Grant/Navy Surface Warfare Center/REMAX, Lisa Wills, Candy Meyers/Tidewater Machine Shop&Maurice J. Mcdonough High School&North Point High School",RoboRaptors,Pomfret,Maryland,USA,2011,,CHS,Maurice J. Mcdonough High School & North Point High School,,CMPMI
1382,3651,Greenville County Schools & TRAVELERS REST HIGH,TRIBE,Travelers Rest,South Carolina,USA,2011,,,Travelers Rest High,,CMPTX
1383,3653,"Motorola Solutions Foundation/State of Florida/Publix/Florida Power and Light/Traeger Brothers and Associates/Prospect Plastics/Hydra Aquatics/West Broward High School/Counseling and Wellness Center of South Florida/Heyd Tutoring: Math and Reading K-12, SAT & ACT Prep/ins'Tent&West Broward High School",BOTCATS,Hollywood,Florida,USA,2011,,,West Broward High School,,CMPTX
1384,3654,Arconic Foundation/UTC/Bob's Discount Furniture/Microsoft/Solid Works/Lauren States/Hobson Motzer/Swanny Seirup/Tom and Nancy Clayton/4-H&Mercy High School,TechTigers,Middletown,Connecticut,USA,2011,,NE,Mercy High School,,CMPMI
1385,3655,Dart Container/Dakkota Integrated Systems/LOC Performance/Central Process Engineering/Gestamp/Block Imaging/Spartan Motor/Mason Optimist/Mason Public Schools Foundation/The Dart Foundation/MSUFCU/Mason ACE Hardware/Wesco Distribution&Mason High School,Tractor Technicians,Mason,Michigan,USA,2011,,FIM,Mason High School,,CMPMI
1386,3656,"Michigan Aerospace/Springmatter/Yan Feng/Ford Motor Company/Michigan DOE/Education Foundation of Dexter/Dexter Research Center, Inc./Dexter Lions Club/Tri-State Communications/Hatch Stamping Company/Dexter A & W Restaurant/ESI/Maker Works/Hella/Dusty's Collision/Kaiser Optical&Dexter High School",Dreadbots,Dexter,Michigan,USA,2011,,FIM,Dexter High School,,CMPMI
1387,3658,Denso /Team Alliance Plastics/John and Anne Seppanen/Omega Casting Inc./Kellog Comunity College/Kendall Electric /Meijer&Harper Creek High School,Robo - Beavers,Battle Creek,Michigan,USA,2011,,FIM,Harper Creek High School,,CMPMI
1388,3660,NDEP/Boeing/Northrop Grumman&Home School,LIGHTSABERS,Oklahoma City,Oklahoma,USA,2011,,,Home School,,CMPTX
1389,3661,"Southern Fabricators, Inc/Duke Energy  & Anson County 4-H",RoboWolves,Wadesboro,North Carolina,USA,2011,,NC,Anson County 4-H,,CMPTX
1390,3663,"The Boeing Company/Team Nelson Earthwork and Utilities/The Mindy Group, LLC/Electro Impact/Inside & Out Renovation, Inc./Philips/SPEEA/Precision Image&Cedar Park Christian Schools",CPR - Cedar Park Robotics,Bothell,Washington,USA,2011,,PNW,Cedar Park Christian Schools,,CMPTX
1391,3667,"Port Huron Area School  District Horizons 21st Century Community Learning Centers/Cargill  /BioPro - Biologically Oriented Protheses/Marshall E. Campbell Co./Triton Automation Group, LLC/McLaren Port Huron Hospital/Huron Construction Services/Suburban Bolt & Port Huron Northern High School & Port Huron High School",Mecanum Knights,Port Huron,Michigan,USA,2011,,FIM,Port Huron Northern High School & Port Huron High School,,CMPMI
1392,3668,"Delphi/State of Michigan/RheTech/Dura/Durr/Lance and Nola Shew/Thomson Reuters/Fortune Tool & Machine/BTI/Kiwanis of Whitmore Lake/Ruth Brown & David Sokolowski/Dr. Travis Sterner, DDS/Mary Tummonds/Atlas Home Improvement/BJW Group/Van's Archery Center/ViperSpace/Glenn Burchi/Whitmore Lake Tavern/Polly Market&Whitmore Lake High School",TroBots,Whitmore Lake,Michigan,USA,2011,,FIM,Whitmore Lake High School,,CMPMI
1393,3669,Ram Mechanical/Ripon Christian Schools&Ripon Christian,RoboKnights,Ripon,California,USA,2011,,,Ripon Christian,,CMPTX
1394,3673,Oregon Department of Education/Boeing/Tom Briggs/Seaside Public Schools/Wells Fargo/Pacific Power Foundation/Autodesk/3 Course Challenge Cross Country Race/City of Cannon Beach/Martin Hospitality/Ace Hardware/Seaside Tsunami Amateur Radio Society/Tony Vandershule/Freedom Northwest/Halliburton/Seaside Lazerquick/Clatsop Community Bank/Sign One/Sam's Seaside Cafe/Kiwi Glass/White's Sheet Metal and Heating/Bank of the Pacific/TLC-Fibre Credit Union/Dassault Systems&Seaside High School&Seaside High School,C.Y.B.O.R.G. Seagulls,Seaside,Oregon,USA,2011,,PNW,Seaside High School & Seaside High School,,CMPTX
1395,3674,Boeing/US Digital/HP/OSPI / CAM Academy/Olin Homes/Superior Home Inspection /Gazelles International Coaches/Epp Well Solutions & Cam Jr Sr High School & Family/Community,CloverBots,Battle Ground,Washington,USA,2011,,PNW,Family/Community & Cam Jr Sr High School,,CMPTX
1396,3676,"Lockheed Martin/Mouser Electronics/Texas Workforce Commission/General Motors/SER Jobs for Progress National, Inc.&Martin H S",Warrior Robotics,Arlington,Texas,USA,2011,,,Martin H S,,CMPTX
1397,3679,Amazon/Texas Workforce Commission/FIRST in Texas&San Marcos H S,rattlers,San Marcos,Texas,USA,2011,,,San Marcos H S,,CMPTX
1398,3680,Iredell 4-H/SAVElectronics/Duke Energy/GATES & South Iredell High & Iredell 4-H Robotics & Statesville Christian School & Collaborative College of Techn,Elemental Dragons,Statesville,North Carolina,USA,2011,,NC,South Iredell High & Iredell 4-H Robotics & Collaborative College of Techn,,CMPTX
1400,3684,The Boeing Company/Google/Microsoft Corporation&Cleveland High School,Electric Eagles,Seattle,Washington,USA,2011,,PNW,Cleveland High School,,CMPTX
1401,3688,Northern Building Supply/Sherwood Manufacturing Co./Electro Optics Technology/Insight Optometry/Rent-A-Chicken/Suttons Bay Bingham Foundation/Suttons Bay Leelanau Rotary Club/Martinson Funeral Home/State of Michigan/Enerdyne/Radio Shack of Suttons Bay/DargaWorks/Rick Simonton Merrill Lynch/Northwest Michigan Industrial Association&Suttons Bay Senior High School,Norsemen,Suttons Bay,Michigan,USA,2011,,FIM,Suttons Bay Senior High School,,CMPMI
1402,3691,"Multek/Mr. JST Technology Consulting/Bamco Inc./Northfield Healthy Community Initiative/General Dynamics/Medtronic/Carleton College/St. Olaf College/TBC, LLC/Top Hat Finishing/JBT FoodTech/Benjamin Bus Company&Northfield Senior High",RoboRaiders,Northfield,Minnesota,USA,2011,,,Northfield Senior High,,CMPMI
1403,3692,Prent Thermoform Plastic Packaging/School District of Janesville/Rockwell Automation/Werner Electric/Capital Trust/Isthmus Engineering & Manufacturing Coop/Jay's Big Rolls/IEEE Rock Valley Section/Kisting Plumbing/Rhyme Office Business Products/Blackhawk Technical College/Clinton Aluminum/Pierson Products/Automation Solutions of America/TheCreeds.Net&Parker High&Craig High&Clinton High&Milton High,Rock N' Robotics,Janesville,Wisconsin,USA,2011,,,Milton High & Craig High & Parker High & Clinton High,,CMPMI
1404,3693,Cody Singer Inc./Costco in the Spokane Valley/First Robotics/Autodesk/Greenburo Screen Printing/Ace Hardware Hillyard&Rogers High School,GearHead Pirates,Spokane,Washington,USA,2011,,PNW,Rogers High School,,CMPTX
1405,3694,North Atlanta High School Foundation/Gerding Collaborative/The Cruise Authority/HopArch LLC/Women in Technology/Gate 6 Solutions/AUDH Americas/Atlanta Public Schools/Kennesaw State University/Art Plumbing Contractors & North Atlanta High School & North Atlanta High School,NAHS Warbotz,Atlanta,Georgia,USA,2011,,PCH,North Atlanta High School & North Atlanta High School,,CMPTX
1406,3695,Hendrickson/Navistar&Yorkville High School,Foximus Prime,Yorkville,Illinois,USA,2011,,,Yorkville High School,,CMPMI
1407,3704,Caterpillar-Solar Turbines/Qualcomm/NavAir/SolidWorks&Sweetwater High,Robosapiens,National City,California,USA,2011,,,Sweetwater High,,CMPTX
1408,3707,Brighton Area Schools/Eberspaecher Inc./General Motors/Ilmor Engineering/Hitachi/Ford/State of Michigan/Conely Auto&Brighton High School,Brighton TechnoDogs,Brighton,Michigan,USA,2011,,FIM,Brighton High School,,CMPMI
1409,3711,Nelson Brothers Engineering/Little Mountain Hardware/Terry Schmid Gravel/JoeScan/OSPI/The Boeing Company/Google/Microsoft/Tum A Lum Lumber/ICE/Show and Go Studes/Ed Poe Agency&Trout Lake School,Iron Mustang,Trout Lake,Washington,USA,2011,,PNW,Trout Lake School,,CMPTX
1410,3712,Union School District/Black Distributing/Oregon Masons/Union Lions Club/GRV Lodge #56/VFW Post 4060&Union High School,RoboCats,Union,Oregon,USA,2011,,PNW,Union High School,,CMPTX
1411,3714,Charles Herbert Flowers High,SOAR (Students of Applied Robotics),Springdale,Maryland,USA,2011,,CHS,Charles Herbert Flowers High,,CMPMI
1412,3719,Dominion Millstone Power Station&Science and Technology Magnet High School of Southeastern Connecticut&New London High School,STEM Whalers ,New London ,Connecticut,USA,2011,,NE,Science and Technology Magnet High School of Southeastern Connecticut & New London High School,,CMPMI
1413,3721,SPAWAR (Space and Naval Warfare) Systems Center Pacific/DOD STEM/HECO (Hawaiian Electric Company)/Pearl City Lion's Club/Senator Clarence Nishihara/Friends of Hawaii Robotics/McDonalds of Hawaii/Representative Gregg Takayama&Pearl City High School,Charger Robotics,Pearl CIty,Hawaii,USA,2011,,,Pearl City High School,,CMPTX
1414,3723,Southland Auto & Diesel & Kingsland Senior High,TEKnights,Spring Valley,Minnesota,USA,2011,,,Kingsland Senior High,,CMPMI
1415,3728,Harmony Science Academy,Momentum,Houston,Texas,USA,2011,,,Harmony Science Academy,,CMPTX
1416,3729,"Lockheed Martin/Accudyne/Rockwell Automation/Deep Space Systems, Inc. & Regis Jesuit High School/Boys Division",The Raiders,Aurora,Colorado,USA,2011,,,Regis Jesuit High School/Boys Division,,CMPTX
1417,3734,The Boeing Company & LAKE FOREST ACADEMY,Caxys,Lake Forest,Illinois,USA,2011,,,Lake Forest Academy,,CMPMI
1418,3735,"NRG Energy/Nabors Industries/Lone Star College, University Park, Energy and Manufacturing Institute/Champion Fiberglass/Black and Veatch/First in Texas/Texas Workforce Commision/Crow Corporation/Champion Technologies/Dassault Systèmes SolidWorks/Regal Plastics&Klein ISD",VorTX,Spring,Texas,USA,2011,,,Klein ISD,,CMPTX
1419,3737,Lockheed Martin/Duke Energy/Southern Bank/SPX FLOW/Wayne County Services/Benton & Sons/Mount Olive Pickle/Wayne Auto Salvage/Jackson & Sons/Schneidder Electric/NC Manufacturing/SPX&4-H,Roto-Raptors,Goldsboro,North Carolina,USA,2011,,NC,4-H,,CMPTX
1421,3740,Medtronic Foundation & Sauk Rapids-Rice Senior High,Storm Robotics,Sauk Rapids,Minnesota,USA,2011,,,Sauk Rapids-Rice Senior High,,CMPMI
1422,3743,First Robotics Competition (FRC)/First in Texas/Salado ISD/Salado Education Foundation/Dell Computers/Freddy's/McCoy's/The Nest/EOS 3D Printing/Gonzo's Fab Works & CNC/Wings on Main/Geek Seek/Brookshire Brothers/Opal Divine's/Allied Black and White Welding LLC&Salado H S,Eagle Bots,Salado,Texas,USA,2011,,,Salado H S,,CMPTX
1423,3745,3M/Boston Scientific/Tom & Barbara Murphy/The Governors Club/Midway Men's Club&Johnson Senior High,Governors,Saint Paul,Minnesota,USA,2011,,,Johnson Senior High,,CMPMI
1424,3748,Motorola/BAE Systems/Booz Allen Hamilton/Ciena/Mount Hebron High School & Mount Hebron High,Ragnarok Robotics,Ellicott City,Maryland,USA,2011,,CHS,Mount Hebron High,,CMPMI
1425,3749,NDEP/Northrop Grumman/Teradata & Del Norte High,Team Optix,San Diego,California,USA,2011,,,Del Norte High,,CMPTX
1426,3750,Medtronic/Brach & Jan Svboda/Keith & Jan Burkel/Border State Bank/Wahl Brothers Racing/Central Boiler/Polaris Industries/Roseau County Co-Op Association&Badger Secondary,Gator Robotics,Badger,Minnesota,USA,2011,,,Badger Secondary,,CMPMI
1427,3751,Red Wing Shoe/Pinnacle Wall Systems & Tower View Alternative High School,Tower View Robotics,Red Wing,Minnesota,USA,2011,,,Tower View Alternative High School,,CMPMI
1428,3753,Albemarle Foundation & Parkview Baptist School,BulahBots!,Baton Rouge,Louisiana,USA,2011,,,Parkview Baptist School,,CMPTX
1429,3754,3Suns Research/3M/Tennant Company/TEAM Industries&Treknorth High School,TrekNorth First City Robotics,Bemidji,Minnesota,USA,2011,,,Treknorth High School,,CMPMI
1430,3755,Pentair & Litchfield Senior High,Dragon Robotics,Litchfield,Minnesota,USA,2011,,,Litchfield Senior High,,CMPMI
1432,3759,St Mary'S Academy,SMARTBOTS,INGLEWOOD,California,USA,2011,,,St Mary'S Academy,,CMPTX
1433,3760,16 Hertz LLC / Bronx Aerospace High School / Society of Women Engineers  & Bronx Aerospace High School,Aerospace,Bronx,New York,USA,2011,,,Bronx Aerospace High School,,CMPMI
1434,3767,"Traverse City Area Public Schools/World Magnetics/RJG, Inc./Traverse City Products, Inc./Avanti Engineering/Rotary Charities of Traverse City&West Senior High",Titan Robotics,Traverse City,Michigan,USA,2011,,FIM,West Senior High,,CMPMI
1435,3770,FIRST-GLBR/Dow Chemical/The Kepler Family/Floyd Arbor of Gleaner Life Insurance Society&Bullock Creek High School,BlitzCreek,Midland,Michigan,USA,2011,,FIM,Bullock Creek High School,,CMPMI
1436,3773,Kiwanis Club of Tecumseh/SALINE ELECTRONICS/TLC Tecumseh Community Credit Company/Allstate/Edward Jones&Tecumseh High School,Cobalt Commanders,Tecumseh,Michigan,USA,2011,,FIM,Tecumseh High School,,CMPMI
1437,3777,Lima Family YMCA/United Way of Greater Lima/Husky Lima Refinery /Superior Federal Credit Union /Sandkulh Clayworks&Lima Family YMCA,Bean City Bots,Lima,Ohio,USA,2011,,,Lima Family YMCA,,CMPMI
1438,3785,Yuma Community Robotics/General Motors & Yuma Catholic High School,ROCK'EM SHOCK'EM ROBOTICS,Yuma,Arizona,USA,2011,,,Yuma Catholic High School,,CMPTX
1439,3786,"The Boeing Company/Hexcel Corporation/SPEEA/Kent School District, Career & Technical Education/Kent Community Fondation/Kent Rotary Club&Kentridge High School",Chargers,Kent,Washington,USA,2011,,PNW,Kentridge High School,,CMPTX
1440,3792,"Boeing/University of Missouri-Columbia/Inquest Environmental/Ford/Andrew Winslow, Ph.D/Kevin Womack & Family/Community",The Army Ants,Columbia,Missouri,USA,2011,,,Family/Community,,CMPTX
1441,3793,Bechtel/Lockheed-Martin & Middletown High & Frederick High & St John Regional Catholic School & Tuscarora High,CyberTitans,Frederick,Maryland,USA,2011,,CHS,St John Regional Catholic School & Frederick High & Middletown High & Tuscarora High,,CMPMI
1443,3796,"FIRST/NC-FIRST/PERDUE FARMS INC./Pitt County Robotics Team (2682 & 2642)/Robotics Club and  parents/Dan Pittman Insurance Agency/Bill Clough Ford Inc./Bertie County Public School Foundation, Inc./KS Networks/Boeing&Bertie Stem High",Technical Assassins,Windsor,North Carolina,USA,2011,,NC,Bertie Stem High,,CMPTX
1444,3799,Corning Incorporated/Carbaugh Tool/Hardinge Group&Notre Dame High School,Electric Fire,Elmira,New York,USA,2011,,,Notre Dame High School,,CMPMI
1445,3800,McDonald's Restaurants of Hawaii&Kalaheo High School,Mustangs,Kailua,Hawaii,USA,2011,,,Kalaheo High School,,CMPTX
1446,3802,Prince of Peace Christian School/Orb Polymer/3MD Media Marketing MD/Mouser Electronics&Prince of Peace Christian School,RoboPOP,Carrollton,Texas,USA,2011,,,Prince of Peace Christian School,,CMPTX
1447,3807,Comcast/Mikron&Overland High School,Overland BlazerBots,Aurora,Colorado,USA,2011,,,Overland High School,,CMPTX
1448,3812,Weyerhaeuser/Boeing/OSPI/Kenworth - PACCAR/NW Institute of Electrical Technology/Steelscape&Mark Morris High School,Bits & Bots,Longview,Washington,USA,2011,,PNW,Mark Morris High School,,CMPTX
1449,3814,Bosch / Regal / Acramold / Mazak / Duke Energy / ACE Machining / H3 Technologies / NKIP / BCEF & Larry A. Ryle High School & Randall K. Cooper High School & Boone County High School & Conner High School,PiBotics,Florence,Kentucky,USA,2011,,,Larry A. Ryle High School & Randall K. Cooper High School & Boone County High School & Conner High School,,CMPMI
1450,3815,Automation Direct & North Forsyth High School,NF Raiders,Cumming,Georgia,USA,2011,,PCH,North Forsyth High School,,CMPTX
1451,3821,Kentucky AEP/4-H & Belfry High School,Pirabots,Belfry,Kentucky,USA,2011,,,Belfry High School,,CMPMI
1452,3822,John Deere / Central Carolina Community College / Qorvo / Charles and Martha Oldham & Jordan Matthews High,Neon Jets,Siler City,North Carolina,USA,2011,,NC,Jordan Matthews High,,CMPTX
1453,3824,Bechtel/GKN/Knox County Schools/Techmer PM/TVA/EPRI/INGENUTEC/ARCONIC/ORNL/Tuff Torq/Consolidated Nuclear Security/The Home Depot/SolidWorks/Millennitek&Hardin Valley Academy,HVA RoHAWKtics,Knoxville,Tennessee,USA,2011,,,Hardin Valley Academy,,CMPTX
1454,3826,Sequim School District/OSPI/Boeing/Sodexo&Sequim Senior High,"Sequim Robotics Federation ""SRF"" ",Sequim,Washington,USA,2011,,PNW,Sequim Senior High,,CMPTX
1455,3834,ALCOA Foundation/Texas Workforce Commission/Inteplast/IBC/Bush's Chicken/Domino's&Calhoun H S,Crab-bots,Port Lavaca,Texas,USA,2011,,,Calhoun H S,,CMPTX
1457,3838,"Rochester City School District/Thomson Reuters/Optimation and Kingsbury/SMC Metal/AutoDesk/SolidWorks & Edison Career and Technology High School & Pathways in Technology Program, Rochester & The Rochester City School District & School 58-World of Inquiry School",Roc City Robotix,Rochester,New York,USA,2011,,,"Pathways in Technology Program, Rochester & Edison Career and Technology High School & The Rochester City School District & School 58-World of Inquiry School",,CMPMI
1458,3839,Wadena-Deer Creek Senior High,SWOLVERINES,Wadena,Minnesota,USA,2011,,,Wadena-Deer Creek Senior High,,CMPMI
1459,3840,Medtronic Inc/Automation Inc/Mechatronic Solutions &Isanti County 4-H,Teens 'Nto Technology,Isanti,Minnesota,USA,2011,,,Isanti County 4-H,,CMPMI
1460,3843,Murray Calloway Area Technology Center/Murray State University Institute of Engineering/Calloway County 4H & Murray/Calloway County Area Tech Center & CALLOWAY COUNTY 4H & Calloway County High School & Murray High School,M.C.R.T. ROBO RACERS,Murray,Kentucky,USA,2011,,,Murray/Calloway County Area Tech Center & CALLOWAY COUNTY 4H & Calloway County High School & Murray High School,,CMPMI
1461,3844,Jackson MSC/Knox 4H Kentucky/Knox County Board of Education/CTA Acoustics/Firestone&Lynn Camp High School,Kentucky Wildbots,Corbin,Kentucky,USA,2011,,,Lynn Camp High School,,CMPMI
1462,3845,Duke Energy/2017 FRC Hardship Grant&Carver High,Yellow Jackets,Winston-Salem,North Carolina,USA,2011,,NC,Carver High,,CMPTX
1463,3847,"NRG/Texas Workforce Commission/Solarcraft, Inc/FIRST in Texas/ExxonMobil/International Society of Automation, Houston Chapter/Star Precision Fabricating/Royalty Metal Finishing/DS Solidworks&St Agnes Academy School&Strake Jesuit College Prep School",Spectrum   -△◅,Houston,Texas,USA,2011,,,St Agnes Academy School & Strake Jesuit College Prep School,,CMPTX
1464,3848,MONSANTO/Walmart&Kenyon-Wanamingo Senior High,Bots in Shining Armour,Kenyon,Minnesota,USA,2011,,,Kenyon-Wanamingo Senior High,,CMPMI
1465,3851,Northrop Grumman & Canoga Park Senior High,The Short Circuits ,Canoga Park,California,USA,2011,,,Canoga Park Senior High,,CMPTX
1466,3853,Lawrence Semiconductor Research Laboratory/the next great event/Avent/Microchip CAD Engineers/Terracon/Right Honda/Prides Peak/Rocket Book/Community Tax Credit&Mountain Pointe High School,Pridetronics,Phoenix,Arizona,USA,2011,,,Mountain Pointe High School,,CMPTX
1467,3859,Schilling Robotics/NASA/Apple/Stanley Black & Decker/Boeing/Jeetaw Manufacturing/Best Buy/McKesson Corporation/Intuitive Surgical/ACEC Sierra Chapter/Go Pro&Cosumnes Oaks High,Wolfpack Robotics,Elk Grove,California,USA,2011,,,Cosumnes Oaks High,,CMPTX
1468,3863,Haas Automation/California Community Colleges/IEEE&Newbury Park High,Pantherbotics,Newbury Park,California,USA,2011,,,Newbury Park High,,CMPTX
1469,3865,"YMCA of Michiana, Inc./South Bend Alumni Association&Riley High School",Riley WildBots,South Bend,Indiana,USA,2011,,IN,Riley High School,,CMPMI
1470,3871,ISD 518/Bedford Industries/Medtronic&Worthington Senior High,Trojan Robotics,Worthington,Minnesota,USA,2011,,,Worthington Senior High,,CMPMI
1471,3875,Switch/GE Aviation/Volunteers of GE Aviation Systems/Bosch/Lacks Enterprises/Hutchinson Anti-Vibration/Dematic/Kentwood Public Schools/Michigan Department of Education/Savant Automation/Custom Profile&East Kentwood High School&East Kentwood Freshman Campus,Red Storm Robotics,Kentwood,Michigan,USA,2011,,FIM,East Kentwood Freshman Campus & East Kentwood High School,,CMPMI
1472,3876,Bezos Family Foundation/PTC & Mabton Jr. Sr. High,Mabton LugNutz,Mabton,Washington,USA,2011,,PNW,Mabton Jr. Sr. High,,CMPTX
1473,3878,Friends of the Future/Konawaena High School&Konawaena High School,Wildcats,Kealakekua ,Hawaii,USA,2011,,,Konawaena High School,,CMPTX
1474,3880,"NASA, BAE Systems, Friends of Hawaii Robotics, Maui Economic Development Board, Ace Hardware, UH Manoa College of Engineering, Thirty Meter Telescope, HELCO, Oceanic Time Warner Cable, ABC Stores, Andy Mark, Robotics Organizing Committee(ROC), Cyanotech,  / Society of Women Engineers & KEALAKEHE HIGH SCHOOL",Tiki Techs,Kailua Kona,Hawaii,USA,2011,,,Kealakehe High School,,CMPTX
1475,3881,Railing Systems Hawaii/Exploration Foundation/Fairwinds&West Hawaii Explorations Academy - Pcs,WHEA Sharkbots,Kailua Kona,Hawaii,USA,2011,,,West Hawaii Explorations Academy - Pcs,,CMPTX
1476,3882,Lahainaluna High School Foundation/MEDB Ke Alahele Grant/Boeing Company/Maui Electric/Aloha Self Storage/Goodfellow Brothers/Engineering Dynamics/Maui Petroleum/Maui Oil Company/Frogman Charters Lahaina/Monsanto/Gazebo Restaurant Lahaina/Nagamine Photo/UFO Parasail/Atlantis Submarine Maui&Lahainaluna High School,Lunas,Lahaina,Hawaii,USA,2011,,,Lahainaluna High School,,CMPTX
1477,3883,"3 M/Andeavor/Wipaire, Inc./Thomson Reuters&Park Senior High",Data Bits,Cottage Grove,Minnesota,USA,2011,,,Park Senior High,,CMPMI
