,teamNumber,nameFull,nameShort,city,stateProv,country,rookieYear,robotName,districtCode,schoolName,website,homeCMP
2289,5468,"AutoDesk/Emediacy/CBT Nuggets/Streamline Solar/Slayden Construction/Outback Manufacturing/Brooks Resources/Van Valkenburg Design/BLJ Attorneys at Law/Hendrix, Brinich & Bertalan LLP/Bend Research/Sunwest Builders/AUVSI/Miller Lumber/Duane Stevens/Bend Plating/Dave Robinson Architects/Precision Hanywork/Susan Metzdorf/Skyline Dental&Summit High School",Chaos Theory,Bend,Oregon,USA,2015,,PNW,Summit High School,,CMPTX
2290,5470,GVSU School of Engineering/West Michigan Precision Metalforming Association/Disher Design/Reeves Plastics/Rodeway Inn/IT Resource&Coopersville High School,The Cowpunchers,Coopersville,Michigan,USA,2015,,FIM,Coopersville High School,,CMPMI
2291,5471,Robotics Institute of Maine/American Legion Post #40/American Legion Unit #40 Auxiliary/American Legion Post #40 Riders&Winthrop High School,W.Hi.R.R.,Winthrop,Maine,USA,2015,,NE,Winthrop High School,,CMPMI
2292,5472,LexisNexis/Snap-on Tools/American Automobile Association/Partsmaster/State of Florida/Mimessi Auto Design/Classic Fence/Sick Inc./Saito's Japanese Steakhouse&American Heritage School - Boca/Delray,Stallion Robotics,Delray Beach,Florida,USA,2015,,,American Heritage School - Boca/Delray,,CMPTX
2293,5473,NASA/GE Aviation Systems/Michigan Department of Education/SolidWorks/Relevant Networks & West Michigan Aviation Academy,Team Spitfire.,Grand Rapids,Michigan,USA,2015,,FIM,West Michigan Aviation Academy,,CMPMI
2294,5474,Qualcomm / NASA / Mitchell International /Rotary International &Clairemont High,Clairemonster,San Diego,California,USA,2015,,,Clairemont High,,CMPTX
2295,5477,NASA/Qualcomm/Tobolski Watkins Engineering/WE-Supply (Willy's Electronic Supply)&National University Academy,NuBotX - Nubotics STEAMPunk,Vista,California,USA,2015,,,National University Academy,,CMPTX
2296,5478,NASA/Deloitte LLP/Ford Motor Company/Michigan Engineering Zone/Google/Toyota/McNaughton-McKay Electric Company/The Berg Family/DADARA/DTE Energy & Pershing High School,Pershing Doughbots,Detroit,Michigan,USA,2015,,FIM,Pershing High School,,CMPMI
2297,5480,"The Davidson Academy/University of Nevada Reno, Office of Research and Innovation/University of Nevada Reno, Innevation Center, Powered by Switch/Smartdraw/Jensen Metal Tech/Western Nevada Supply/Panavise/Newmont Mining/Wayne's Auto Center/Clickbond/Ozmen Foundation/NAPA/Vital Systems/Wet Labs & Family/Community",FYRE (FIRST Young Robotics Engineers),Reno,Nevada,USA,2015,,,Family/Community,,CMPTX
2298,5482,The Lovett School,Roarbotics,Atlanta,Georgia,USA,2015,,PCH,The Lovett School,,CMPTX
2300,5484,Career Academy South Bend&Career Academy South Bend,Career Academy Robotics,South Bend,Indiana,USA,2015,,IN,Career Academy South Bend,,CMPMI
2301,5486,Lake Linden-Hubbell High School,Robotic Turmoil,Lake Linden,Michigan,USA,2015,,FIM,Lake Linden-Hubbell High School,,CMPMI
2302,5490,Moravian Academy,The Dark Byte,Bethlehem,Pennsylvania,USA,2015,,MAR,Moravian Academy,,CMPMI
2303,5491,the Winchendon School,Cognitive Hazard,Winchendon,Massachusetts,USA,2015,,NE,the Winchendon School,,CMPMI
2304,5492,UPS/Kentucky Colonels/FrankDesign/Johnson Controls/Strand & Associates/FirstBuild/LG&E Power/B & B Screw Machine /Clariant/Vitronic/Allied Automation/University of Louisville JB School of Engineering&Family/Community,Winner's Circle Robo Jockeys,Louisville,Kentucky,USA,2015,,,Family/Community,,CMPMI
2305,5493,Comcast NBCUniversal/Lockheed-Martin/SCTE/NCM&St Mary'S Academy,SMAbotics AG,Englewood,Colorado,USA,2015,,,St Mary'S Academy,,CMPTX
2306,5494,"Harry's Mold and Machine, Arc Industries, Bulger Partners&Holbrook Jr Sr High",Bizarbots Robotics,Holbrook,Massachusetts,USA,2015,,NE,Holbrook Jr Sr High,,CMPMI
2307,5496,Genentech/Comcast /Nvidia /Vacaville Public Education Foundation/Pacific ACE Hardware/JC Grafix/Whit Whitman/Banks Integration/The LaRowe Family/United Airlines&Elise P. Buckingham Charter Magnet High,Robo Knights,Vacaville,California,USA,2015,,,Elise P. Buckingham Charter Magnet High,,CMPTX
2308,5498,Fiat Chrysler Automobiles/Ford Motor Company/BASF&Grosse Ile High School,Wired Devils,Grosse Ile,Michigan,USA,2015,,FIM,Grosse Ile High School,,CMPMI
2309,5499,NASA/Google/Qualcomm/Berkeley Screen Printing Company/Acosta Sheet Metal Manufacturing/Lakireddy Family/Gorilla Metals/SolidWorks/Hasselgren Engineering/HSC Electronic Supply/Geekbot/Pioneers in Engineering Foundation&Family/Community,The Bay Orangutans,Berkeley,California,USA,2015,,,Family/Community,,CMPTX
2310,5500,Motorcar Parts of America (MPA)&Cabrillo (Juan Rodriguez) High,Jaguars Robotics & ROVs,Long Beach,California,USA,2015,,,Cabrillo (Juan Rodriguez) High,,CMPTX
2311,5501,Burr Oak High School/Professional Climbers Tree Service&Burr Oak High School,Bobcats,Burr Oak,Michigan,USA,2015,,FIM,Burr Oak High School,,CMPMI
2312,5502,Martinrea/Cobra Motorcycle Mfg/Mr Rooter/OrbitForm/Rotary Club/StockHouse Printing/Solidworks/Jonesville Tool/Walmart&Jonesville High School,Cobrots,Jonesville,Michigan,USA,2015,,FIM,Jonesville High School,,CMPMI
2313,5503,NASA & Smithville H S,Smithville Tiger Trons,Smithville,Texas,USA,2015,,,Smithville H S,,CMPTX
2314,5504,Pinconning High School,The Loose Connections,Pinconning ,Michigan,USA,2015,,FIM,Pinconning High School,,CMPMI
2315,5505,"PCI Manuf / Employment Services, Inc. / State of Michigan / Alpena County Youth and Rec / LaFarge / Alpena Public Schools & Alpena High School",V2 Robotics,Alpena,Michigan,USA,2015,,FIM,Alpena High School,,CMPMI
2316,5506,RSU #20/Robotics Institute of Maine/GitHub/Gabe Baker/Greg's Auto Sales&Searsport District High School,Midcoast MAINEiacs,Searsport,Maine,USA,2015,,NE,Searsport District High School,,CMPMI
2317,5507,George Washington High,Robotic Eagles,San Francisco,California,USA,2015,,,George Washington High,,CMPTX
2318,5508,Bechtel/Arconic&Family/Community,Wolfbots,Knoxville,Tennessee,USA,2015,,,Family/Community,,CMPTX
2319,5509,FIRST GLBR/Dow Chemical/MDE Grant/Johnstone Construction/CPI Fluid Engineering/Nexteer Automotive&Midland High School,Like a Boss.,Midland,Michigan,USA,2015,,FIM,Midland High School,,CMPMI
2320,5510,Igus/Roddenberry Foundation/SOLIDWORKS/EstosConnectors & Alexander Hamilton Senior High,The Da Vinci Coders,Los Angeles,California,USA,2015,,,Alexander Hamilton Senior High,,CMPTX
2321,5511,John Deere/TE Connectivity/Cisco/ADR Hydrocut/IBM/Pentair&Cortechs Robotics,Cortechs Robotics,Cary,North Carolina,USA,2015,,NC,Cortechs Robotics,,CMPTX
2323,5514,NASA/Nordson ASYMTEK/Booz Allen Hamilton/ViaSat/Fine Technology Solutions/Dassault Systemes SOLIDWORKS/VMC Machine/San Dieguito Union High School District&La Costa Canyon High,MavBots,Carlsbad,California,USA,2015,,,La Costa Canyon High,,CMPTX
2326,5517,Busch Family/Dynamic Machine of Detroit/Factory 2/Falcon CNC/FIRST in Michigan/Kettering University/Powell-Johnson Family/Serra Foundation/Sue Breeding/Team 862 Lightning Robotics/Transportation Inc/Young's in Owosso&Madison Academy - High School,The Engineers on Fire,Burton,Michigan,USA,2015,,FIM,Madison Academy - High School,,CMPMI
2327,5518,Techno Wolves Robotics Booster Club/Ingenuitas/Qualcomm/Solidworks & Wake Ncsu Stem Echs,Techno Wolves,Apex,North Carolina,USA,2015,,NC,Wake Ncsu Stem Echs,,CMPTX
2330,5523,"Grass Lake Schools/Alro Steel/Kelly Express Mart/ Petty Machine & Tool, Inc &Grass Lake High School",RoboWarriors,Grass Lake,Michigan,USA,2015,,FIM,Grass Lake High School,,CMPMI
2331,5524,Meijer of Birch Run/Saginaw Community Foundation/Graff Chevrolet of Bay City/United Financial Credit Union/Nexteer/General Motors/Consumers Energy/Ford/Birch Run Rotary Club/Birch Run High School/Goalpost Pizza of Birch Run/Mid Michigan Screen Printing&Birch Run High School,MacroProcessors ,Birch Run,Michigan,USA,2015,,FIM,Birch Run High School,,CMPMI
2332,5525,Employment Services Inc./Alpena Community College/Northern Precision/Solid Works/MDE/FIRST/Barton City Eagles Club Post 4141 and Ladies Auxillary/WGBenjey/Stephenson & Co. P.C./Kalitta Air&Alcona Community High School,Alcona Tool Cats,Lincoln,Michigan,USA,2015,,FIM,Alcona Community High School,,CMPMI
2334,5527,International Academy of Flint (K-12),Cyber Phoenix,Flint,Michigan,USA,2015,,FIM,International Academy of Flint (K-12),,CMPMI
2336,5530,Ford/ ZF/Sakti3&Greenhills School,The Lawnmowers,Ann Arbor,Michigan,USA,2015,,FIM,Greenhills School,,CMPMI
2337,5531,Ford Motor  & Dearborn High School,Orange Crush,Dearborn,Michigan,USA,2015,,FIM,Dearborn High School,,CMPMI
2338,5532,University Preparatory Academy (Psad)-High School,The G.O.A.T.S,Detroit,Michigan,USA,2015,,FIM,University Preparatory Academy (Psad)-High School,,CMPMI
2339,5533,Clio High School,Electric Horse Power,Clio,Michigan,USA,2015,,FIM,Clio High School,,CMPMI
2340,5534,"Moran Iron Works & IAI (Industrial Arts Institute)/Republic Services (Elk Run Land Fill)/Village Corner Store (Exxon Mobil)/PIE&G CO-OP/Master Potter and Flint Institute of Art Instructor Guy Adamec/Mr & Mrs. Carl Anderson Family/Maple Ridge Hardwoods, INC. /Pepsi&Onaway Senior High School",Onaway Onabots,Onaway,Michigan,USA,2015,,FIM,Onaway Senior High School,,CMPMI
2341,5535,Creative Manufacturing/Eagle Tech/JR Automation&New Buffalo Senior High School,Bionic Bison,New Buffalo,Michigan,USA,2015,,FIM,New Buffalo Senior High School,,CMPMI
2342,5538,First in the Great Lakes Bay Region/Dow Chemical/Nexteer/Hemlock Semi Conductor/Michigan Department of Education/Saginaw Engineering and Control/Merrill Technologies Group/FB Wright/Glastender/Buffalo Wild Wings/Tim Hortons/Gary Blower/Fullerton Tool Company Inc./Planet Fitness/Glenn Photography/Douglas Family Vision P.C/Terabyte Consulting&Swan Valley High School,Vikingbots,Saginaw,Michigan,USA,2015,,FIM,Swan Valley High School,,CMPMI
2343,5539,Desert View High School,DVHS Cyborgs,Tucson,Arizona,USA,2015,,,Desert View High School,,CMPTX
2344,5541,Amazon Fulfillment/Emerson/Bayer/Entrust Datacard/KEB/TORO&Shakopee Senior High,Shakopee Robotics,Shakopee,Minnesota,USA,2015,,,Shakopee Senior High,,CMPMI
2345,5542,BUFFALO SENIOR HIGH,RoboHerd,Buffalo,Minnesota,USA,2015,,,Buffalo Senior High,,CMPMI
2346,5544,FIRST FRC/St. Anthony of Padua Catholic Church/Novetta Technology/St. Luke Medical Services&SWIFT Robotics Youth Club,SWIFT Robotics,Vass,North Carolina,USA,2015,,NC,SWIFT Robotics Youth Club,,CMPTX
2347,5546,"NASA/Society of American Military Engineers/Waste Management/Bill Sandidge/Anthem/BluePrint Automation/Adobe/Rudy L. Hawkins Electrical Contractor, Inc./Rolls Royce/Virginia State University College of Engineering and Technology/Filipino-American Association of Central Virginia/Patient First&Appomattox Regional Gov. Sch.",⚒️ A.R.T. ⚒️,Petersburg,Virginia,USA,2015,,CHS,Appomattox Regional Gov. Sch.,,CMPMI
2348,5547,Globe Sprinkler/Colvin's Plumbing and Heating of Hale/Kochers Market of Hale/Fernelious Chevrolet of Rose City/Main Street Pizza of Hale&Hale High School,The Talons,Hale,Michigan,USA,2015,,FIM,Hale High School,,CMPMI
2349,5549,Nvidia/Harris Teeter/General Dynamics/Jamie Hyneman&Marshall High,Gryphon Robotics,Falls Church,Virginia,USA,2015,,CHS,Marshall High,,CMPMI
2350,5550,"G & A  Lance Trust/DoD STEM/Boeing/SAIC/Medley Equipment/Bethany First Church of the Nazarene/DARR & COLLINS, L.L.C.  Consulting Engineers&Bethany Hs",Broncho Bots,Bethany,Oklahoma,USA,2015,,,Bethany Hs,,CMPTX
2353,5555,Extra Credit Union/Fitzgerald Foundation/Eddie's Pizza&Fitzgerald Senior High School,Spartans,Warren,Michigan,USA,2015,,FIM,Fitzgerald Senior High School,,CMPMI
2354,5556,Analog Devices/Merrimac Tool Company/Code & Circuit&Sparhawk School&Amesbury High,Carriagetown Robotics,Amesbury,Massachusetts,USA,2015,,NE,Amesbury High & Sparhawk School,,CMPMI
2355,5557,NASA/MaverixLab/American Capital Advisors Group/Access Builders/State of Florida&Gulliver Pinecrest Preparatory School,BB-R8ERS,Miami,Florida,USA,2015,,,Gulliver Pinecrest Preparatory School,,CMPTX
2357,5559,Camden-Frontier High School,Gear Grinders,Camden,Michigan,USA,2015,,FIM,Camden-Frontier High School,,CMPMI
2358,5560,Chris Corbett/EJ/Dayton Lamina/Armour Express/SMC/Mortensen Funeral Home/Central Lake Public Schools&Central Lake Public School,Central Lake Trobotics,Central Lake,Michigan,USA,2015,,FIM,Central Lake Public School,,CMPMI
2359,5561,Esys Automation/Kettering University/Solidworks/Flushing Area Community Foundation/Rotary Club of Flushing&Flushing High School,Raider Robotics,Flushing,Michigan,USA,2015,,FIM,Flushing High School,,CMPMI
2360,5562,"Glen Lake Community Schools/Thompson Racing Fabrication/TriMet Industries, Inc.&Maple City-Glen Lake Jr/Sr High School",Laker Logistics,Maple City,Michigan,USA,2015,,FIM,Maple City-Glen Lake Jr/Sr High School,,CMPMI
2361,5563,St Marys Jr-Sr High School,Phalanx,Lynn,Massachusetts,USA,2015,,NE,St Marys Jr-Sr High School,,CMPMI
2363,5567,Ford Motor Company/Toyota Motor Corporation /The Greater Area Milan Foundation/Mogul Tech/Kent Design&Milan High School,Code Red Robotics ,Milan,Michigan,USA,2015,,FIM,Milan High School,,CMPMI
2364,5568,Precision Compacting Technologies/Harrison French Associates/GelMart/Swope Engineering/Absolute Security Fire & Design /Sugar Creek Model Railroad Club&Bentonville High School&Rogers High School&Life Way Christian School&Pea Ridge Manufacturing & Business Academy,Solid Rock ,Bentonville,Arkansas,USA,2015,,,Pea Ridge Manufacturing & Business Academy & Life Way Christian School & Rogers High School & Bentonville High School,,CMPTX
2366,5572,Tesoro Foundation/Rackspace/North East I.S.D. STEM Academy&Lee H S,ROSBOTS,San Antonio,Texas,USA,2015,,,Lee H S,,CMPTX
2367,5576,Spirit Lake High School,Team Terminator,Spirit Lake,Iowa,USA,2015,,,Spirit Lake High School,,CMPMI
2368,5577,General Motors/Ideal Group/Utility Workers Union of America AFL-CIO local 223/Hosco/DTE/Kettering/GMI Alumni Association/FANUC/Detroit Hispanic Development Corporation&Detroit Cristo Rey High School,Kinematic Wolves,Detroit,Michigan,USA,2015,,FIM,Detroit Cristo Rey High School,,CMPMI
2369,5578,DoD and Boeing &Metro Technology Centers STEM Academy,Metro Mechanical Monsters,Oklahoma City,Oklahoma,USA,2015,,,Metro Technology Centers STEM Academy,,CMPTX
2370,5582,"DAL Global Services/Foundation Ambulance, Inc./Mil-Spec Packaging of Georgia/Candescent Media, Inc.&Trinity Christian School",Rex Machina,Sharpsburg,Georgia,USA,2015,,PCH,Trinity Christian School,,CMPTX
2371,5583,Boeing/Clavius Project&Rosati-Kain High School,SistamatiK,Saint Louis,Missouri,USA,2015,,,Rosati-Kain High School,,CMPTX
2373,5586,Kohler Company/Kiel Machine Works/HUI Manufacturing/Sargento/Amerequip&Kiel High,Bond Brigade,Kiel,Wisconsin,USA,2015,,,Kiel High,,CMPMI
2374,5587,Tc Williams High,Titan Robotics,Alexandria,Virginia,USA,2015,,CHS,Tc Williams High,,CMPMI
2375,5588,Boeing&Holy Names Academy,Reign Robotics,Seattle,Washington,USA,2015,,PNW,Holy Names Academy,,CMPTX
2377,5590,"St. Joseph's Collegiate Institute/Keller Technology Corporation/Dr. Richard J. Buckley/Sinatra & Company Real Estate/ACV Auctions/Curbell Plastics, Inc.&St Joseph'S Collegiate Institute",Alumiboti,Buffalo,New York,USA,2015,,,St Joseph'S Collegiate Institute,,CMPMI
2379,5595,"Bosch Packaging/Nordson Extrusion Dies Industries, LLC & New Richmond High",NRHS TigerBytes,New Richmond,Wisconsin,USA,2015,,,New Richmond High,,CMPMI
2381,5599,Grove School of Engineering/VexPro/SolidWorks/AnchorLabs&Benjamin N Cardozo High School,The Sentinels,Bayside,New York,USA,2015,,,Benjamin N Cardozo High School,,CMPMI
2383,5603,Nexteer/Dow Corning & Bay City Western High School,Rise of the Warrior Bots,Auburn,Michigan,USA,2015,,FIM,Bay City Western High School,,CMPMI
2386,5607,JanTech Services/Qualcomm&Wakefield High,Team Firewall,Raleigh,North Carolina,USA,2015,,NC,Wakefield High,,CMPTX
2387,5608,GE Volunteers/United Technologies/MDT Software&Lassiter High School,Lassiter Robotics,Marietta,Georgia,USA,2015,,PCH,Lassiter High School,,CMPTX
2388,5610,Haworth/ThreeJoy Associates/Gentex&Saugatuck High School,Turbulence  (Saugatuck Robotics),Saugatuck,Michigan,USA,2015,,FIM,Saugatuck High School,,CMPMI
2389,5611,Verden Hs,Neon Tigers,Verden,Oklahoma,USA,2015,,,Verden Hs,,CMPTX
2390,5612,Bentley Senior High School,RoboRaptors,Burton,Michigan,USA,2015,,FIM,Bentley Senior High School,,CMPMI
2391,5613,The Boeing Company/United States Air Force STEM/Society of Women Engineers/Farmers Insurance John Glass/First National Bank of Alamogordo/OteroSTEM/ETV&Alamogordo High&Imago Dei Academy&Cloudcroft High&Home School,ThunderDogs,Alamogordo,New Mexico,USA,2015,,,Home School & Cloudcroft High & Imago Dei Academy & Alamogordo High,,CMPTX
2393,5616,State of Florida&Choctawhatchee Senior High School,Green Machine,Fort Walton Beach,Florida,USA,2015,,,Choctawhatchee Senior High School,,CMPTX
2395,5619,General Motors&Jalen Rose Leadership Academy,Jaguars,Detroit,Michigan,USA,2015,,FIM,Jalen Rose Leadership Academy,,CMPMI
2396,5621,Boeing/Pratt and Whitney UTC/DoD STEM/Edmond North High School/Mathnasium of Edmond&North Hs,Cyberian Huskies,Edmond,Oklahoma,USA,2015,,,North Hs,,CMPTX
2397,5622,State of Michigan/Montcalm Community College/Greenville Tool & Die/Belcan Engineering Group/2017 FRC® Hardship Grant/Anderson & Girls Orchards&Central Montcalm High School,Green Hornets,Stanton,Michigan,USA,2015,,FIM,Central Montcalm High School,,CMPMI
2398,5623,"Beatty Tree Service/Wyant Technical Sales/Weldmax Fabrication/Augusta VFW Post 7956/Lake Michigan Credit Union/Nature's Classroom, Massachusetts /Knappen Milling Company/Askler's Augusta Pharmacy/Augusta VFW Auxiliary 7956/Brett Summerer&Galesburg-Augusta High School",Robotic Rams,Galesburg,Michigan,USA,2015,,FIM,Galesburg-Augusta High School,,CMPMI
2399,5624,Kobo Products/Picatinny Arsenal/Jack Pedersen Realty/Elks Lodge 2298/Firehouse Grill&South Plainfield High,TIGER TECH Robotics,South Plainfield,New Jersey,USA,2015,,MAR,South Plainfield High,,CMPMI
2400,5625,NASA/AEF/Boeing/MEDB - Maui economic Development Baord/FedEx/Tsukuihama Orthopedics Clinic/Friends of Hawaii Robotics/Oceanic TIme Warner/KS Engineering/Zuken Inc./McDonalds of Hawaii/BAE Systems/PTC & St Anthony Jr/Sr High School,TrojanBots,Wailuku,Hawaii,USA,2015,,,St Anthony Jr/Sr High School,,CMPTX
2401,5626,Cargill/Emerson/Medtronic/NYA VFW/Central Booster Club/Jerry's Frame/Wigen Water Technologies/Orange Ball Creative&Central High School,Nu-matic Ninjas,Norwood Young America,Minnesota,USA,2015,,,Central High School,,CMPMI
2402,5627,NASA/Solar Turbines/Qualcomm & Southwest Senior High,πrtz (Pi-rates),San Diego,California,USA,2015,,,Southwest Senior High,,CMPTX
2404,5632,Georgia Power/Argosy Foundation/NCR Foundation/River Oak Realty Group&Columbia County 4-H Robotics,The Asimovians,Appling,Georgia,USA,2015,,PCH,Columbia County 4-H Robotics,,CMPTX
2405,5633,Maine Institute of Robotics/2015 FRC Rookie Grant & Hyde School,Hyde Cyber Wolves,Bath,Maine,USA,2015,,NE,Hyde School,,CMPMI
2406,5634,The Boeing Co.&St Joseph High School,Jesterminators,Lakewood,California,USA,2015,,,St Joseph High School,,CMPTX
2409,5637,North Senior High,North Minneapolis Robotics,Minneapolis,Minnesota,USA,2015,,,North Senior High,,CMPMI
2410,5638,Lund Implement/Minnwest Bank/Henkel Foundation/Cargill/Appleton Sportsmen Club&Lac Qui Parle Valley Secondary,LQPV Robotics,Madison,Minnesota,USA,2015,,,Lac Qui Parle Valley Secondary,,CMPMI
2411,5639,Psja Southwest H S,Loose Wires,Pharr,Texas,USA,2015,,,Psja Southwest H S,,CMPTX
2412,5641,Byron First United Methodist Church/Mutatio/Youth Advisory Council&Byron Area High School,Byron Robotics,Byron,Michigan,USA,2015,,FIM,Byron Area High School,,CMPMI
2413,5642,Michigan Engineering Zone/Ford Motor Company&Mumford High School,Mumford Mustangs,Detroit,Michigan,USA,2015,,FIM,Mumford High School,,CMPMI
2415,5651,NASA/GE &Maynard H. Jackson- Jr. High School,Jaguar Engineers,Atlanta,Georgia,USA,2015,,PCH,Maynard H. Jackson- Jr. High School,,CMPTX
2416,5653,Medtronic/Lake Country Power/Stone Soup Events and Ely Marathon/Bullseye Cleaning/Champion Auto/Babbitt Short Stop&Babbitt Secondary&North Woods Secondary&Ely School,Iron Mosquitos,Babbitt,Minnesota,USA,2015,,,Ely School & North Woods Secondary & Babbitt Secondary,,CMPMI
2419,5657,Legend of Rawhide/Niobrara Electric Association/Allbright's True Value/Valley Motor Supply/Covered Wagon Motel/NASA Consortium&Niobrara County High School,Rawhide Robotics,Lusk,Wyoming,USA,2015,,,Niobrara County High School,,CMPTX
2420,5658,Medtronic/Nordic Fiberglass/Bremer Bank/MarKit County Grain/Joseph & Heather Wilebski/Rominski Plumbing & Heating Inc/Nordling Farms/Terog Manufacturing/KodaBank&Stephen-Argyle Central High School,STORMBOTICS,Stephen,Minnesota,USA,2015,,,Stephen-Argyle Central High School,,CMPMI
2421,5659,Blue Light Energy/Chaleff and Rogers Architects/The Turck Family/Gennaro Cabinet & Millwork Inc./Harold McMahon Plumbing Solutions/Hampton Tennis Company/SAV-ON Printing /RJ Painting/Mickey's Carting/Mickey's Mowing/Long Island Computer Networks/Advanced Occupational Therapy Services & Bridgehampton School,Team Supreme,Bridgehampton,New York,USA,2015,,,Bridgehampton School,,CMPMI
2422,5660,Burton Chamber of Commerce/Rotary Club of Burton/Genesee Ceramic Tile and Crystal Fieldhouse&Atherton High School,A.R.T. Atherton Robotics Team,Burton,Michigan,USA,2015,,FIM,Atherton High School,,CMPMI
2423,5661,Magliner / Roll-Rite Inc / Globe Sprinkler Systems / Three County Club & Whittemore-Prescott Area H.S.,RoboCards,Whittemore,Michigan,USA,2015,,FIM,Whittemore-Prescott Area H.S.,,CMPMI
2424,5662,Four County Community Foundation/Lapeer County Community Foundation&Dryden High School,A Flock of Nerds,Dryden,Michigan,USA,2015,,FIM,Dryden High School,,CMPMI
2426,5664,ADAC Automotive/Muskegon Community Foundation &Muskegon High School,Big Red Robotics,Muskegon,Michigan,USA,2015,,FIM,Muskegon High School,,CMPMI
2428,5666,NRG & STEMCivics Charter School,Purple Lightning,Trenton,New Jersey,USA,2015,,MAR,STEMCivics Charter School,,CMPMI
2429,5667,New Albany High School/James T. Hutta DDS/Columbus Design & Manufacturing/Information Control Company/Lowe's/Huntington /AEP&New Albany High School,The Digital Eagles,New Albany,Ohio,USA,2015,,,New Albany High School,,CMPMI
2430,5669,Don Bosco Technical Institute & Don Bosco Technical Institute,Techmen,Rosemead,California,USA,2015,,,Don Bosco Technical Institute & Don Bosco Technical Institute,,CMPTX
2432,5674,General Motors/Alro Steel/Eaton Rapids Public Schools/Eaton Rapids Public Schools Education Foundation/Sound EFX Production Services&Eaton Rapids Senior High School,The Gearhounds,Eaton Rapids,Michigan,USA,2015,,FIM,Eaton Rapids Senior High School,,CMPMI
2433,5675,"KVCC the Groves/Monsanto Fund/Kaiser Aluminum/Michigan Department of Education/Mattawan Consolidated Schools/Mattawan Public Education Foundation/Mol-Son/Western Diversified Plastics/John J. Hazelhoff Construction, LLC/Best Way Disposal/Esto Connectors/Rob's Tire and Auto Care/Paw Paw Veterinary Clinic/Bloomingdale Communications&Mattawan High School",WiredCats,Mattawan,Michigan,USA,2015,,FIM,Mattawan High School,,CMPMI
2434,5676,Hillsdale County Community Foundation/Kiwanis of Hillsdale/Martinrea of Jonesville/Hillsdale Community Schools/DMC Associates inc./Hillsdale Community Schools Education Foundation Fund/Hillsdale Terminal/AIS Construction Equipment/Dr. Colin Mayers/Northside Veterinary Hospital/The Hillsdale Market House/G&G Glass/Stillwell Ford and Lincoln/Jim Condon/DRS. Jameson and Nolan/Paragon Metals/Michigan Department of Education&Hillsdale High School,The H.E.R.O.E.S,Hillsdale,Michigan,USA,2015,,FIM,Hillsdale High School,,CMPMI
2435,5678,STEM3 Academy,Knightrise,Valley Glen,California,USA,2015,,,STEM3 Academy,,CMPTX
2436,5679,"Inmar, Inc/Analog Devices/Kiwidyne Labs/ABCO/Virago, LLC/Math-Aids.Com&Girls on Fire",Girls on Fire,Winston Salem,North Carolina,USA,2015,,NC,Girls on Fire,,CMPTX
2437,5681,Southwest H S,Dragonbots,San Antonio,Texas,USA,2015,,,Southwest H S,,CMPTX
2438,5682,Texas Workforce Commission & North Mesquite H S,Equus Engineering,Mesquite,Texas,USA,2015,,,North Mesquite H S,,CMPTX
2439,5683,The Boeing Company/SPEEA&Auburn Riverside High School,Hello World,Auburn,Washington,USA,2015,,PNW,Auburn Riverside High School,,CMPTX
2440,5684,Lockheed Martin /2015 FRC Rookie Grant/Picatinny Arsenal/Mission Solutions LLC/Tuchman Foundation&Trenton Catholic School Upper School,Iron Mechs,Trenton,New Jersey,USA,2015,,MAR,Trenton Catholic School Upper School,,CMPMI
2441,5685,Litchfield High School,Robo Terriers,Litchfield,Michigan,USA,2015,,FIM,Litchfield High School,,CMPMI
2442,5686,United Technologies/Simsbury Precision&Ethel Walker School,Wirecats,Simsbury,Connecticut,USA,2015,,NE,Ethel Walker School,,CMPMI
2443,5687,Baxter Academy for Science & Technology,The Outliers,Portland,Maine,USA,2015,,NE,Baxter Academy for Science & Technology,,CMPMI
2444,5688,Pittsford Area Schools/Alan Cole Flatwork and Masonry /Raymond Lee Custom Carpentry/Kamps Pallets &Pittsford Area High School,Robo Cats,Pittsford,Michigan,USA,2015,,FIM,Pittsford Area High School,,CMPMI
2446,5690,"Burns & McDonnell/The BOLDT Company/Thrivent Financial/Duluth Dodge/Widdes Trailer Sales/Minnesota Power Foundation/Lake Superior Carl Perkins Consortium/Lakehead Constructors, Inc./Benson Electric/ALLETE Clean Energy/Nordex/Wanzek Construction/GE Renewables&Esko High School",SubZero Robotics,Esko,Minnesota,USA,2015,,,Esko High School,,CMPMI
2447,5695,Detroit Diesel / Western Golf and Country Club & Lee M. Thurston High School,Heavy Duty Eagles,Redford,Michigan,USA,2015,,FIM,Lee M. Thurston High School,,CMPMI
2449,5697,Merril Tool/Nexteer/Kurek Tool/Shively Brothers/GLE Precision Carbide/AIS Construction/PF Markey/Endurance Carbide/Iwen Tool and Supply/Amigo & Bridgeport High School,Bearcats,Bridgeport,Michigan,USA,2015,,FIM,Bridgeport High School,,CMPMI
